{
    "name": "debit",
    "@type": "DirectDebit",
    "mandateId": "123",
    "mandateType": "single",
    "accountNumber": "AL47 2121 1009 0000 0002 3569 87411",
    "firstDebitDate": "2021-11-12T17:42:04.317Z",
    "lastDebitDate": "2021-11-12T17:42:04.317Z",
    "owner": "Entity",
    "bank" : "HSBC"
}